{
  "$schema": "https://public-agents.com/schemas/job.schema.json",
  "schemaVersion": 1,
  "id": "sales.summarize-calls",
  "function": "sales",
  "name": "Summarize sales calls into notes and next steps",
  "outcome": "A recorded call becomes notes, objections and next steps a rep would have written.",
  "measures": [
    "summary accuracy rated by reps",
    "time saved per call"
  ],
  "aliases": [
    "call summaries",
    "conversation intelligence",
    "call notes",
    "meeting notes",
    "post call summaries",
    "call recaps"
  ],
  "status": "active",
  "created": "2026-09-05",
  "updated": "2026-09-15",
  "version": 2
}
