{
  "$schema": "https://public-agents.com/schemas/job.schema.json",
  "schemaVersion": 1,
  "id": "scm.track-shipment-exceptions",
  "function": "scm",
  "name": "Detect shipments that will miss their window",
  "outcome": "Delays are detected from carrier and telemetry data early enough to re-plan or warn the customer.",
  "measures": [
    "lead time of exception alerts",
    "missed windows without an alert"
  ],
  "aliases": [
    "shipment visibility",
    "exception management",
    "shipment tracking",
    "late shipment alerts",
    "delay detection",
    "transit visibility"
  ],
  "status": "active",
  "created": "2026-09-05",
  "updated": "2026-09-18",
  "version": 2
}
