{
  "$schema": "https://public-agents.com/schemas/job.schema.json",
  "schemaVersion": 1,
  "id": "mkt.personalize-email",
  "function": "mkt",
  "name": "Personalize email content per segment or recipient",
  "outcome": "Each recipient sees content chosen for them and the campaign outperforms the unpersonalized version.",
  "measures": [
    "uplift over control",
    "segments served"
  ],
  "aliases": [
    "email personalization",
    "dynamic email content",
    "segment level email content",
    "personalized email campaigns",
    "1:1 email content",
    "content personalization"
  ],
  "status": "active",
  "created": "2026-09-05",
  "updated": "2026-09-15",
  "version": 2
}
