{
  "$schema": "https://public-agents.com/schemas/job.schema.json",
  "schemaVersion": 1,
  "id": "proc.draft-rfp",
  "function": "proc",
  "name": "Draft a request for proposal from requirements",
  "outcome": "A stakeholder's requirements become an RFP that suppliers can answer without clarification rounds.",
  "measures": [
    "clarification questions per RFP",
    "time to issue"
  ],
  "aliases": [
    "RFP writing",
    "request for proposal drafting",
    "RFP creation",
    "tender writing",
    "ITT drafting",
    "sourcing document drafting"
  ],
  "status": "active",
  "created": "2026-09-05",
  "updated": "2026-09-15",
  "version": 2
}
