{
  "$schema": "https://public-agents.com/schemas/job.schema.json",
  "schemaVersion": 1,
  "id": "fin.forecast-cash",
  "function": "fin",
  "name": "Forecast cash position over the coming weeks",
  "outcome": "A rolling cash forecast that a treasurer trusts for the next 13 weeks, updated as receivables and payables move.",
  "measures": [
    "forecast error at 4 and 13 weeks",
    "update latency"
  ],
  "aliases": [
    "cash forecasting",
    "treasury forecast"
  ],
  "related": [
    "fin.collect-overdue-receivables",
    "fin.pay-supplier-bills",
    "fin.send-payouts",
    "fin.supply-market-data"
  ],
  "status": "active",
  "created": "2026-09-05",
  "updated": "2026-09-14",
  "version": 2
}
