{
  "$schema": "https://public-agents.com/schemas/job.schema.json",
  "schemaVersion": 1,
  "id": "fin.flag-anomalous-transactions",
  "function": "fin",
  "name": "Flag transactions that look wrong before they post",
  "outcome": "Duplicates, unusual amounts, odd counterparties and policy breaches are flagged before money moves.",
  "measures": [
    "true positive rate",
    "false positive rate",
    "losses prevented"
  ],
  "aliases": [
    "fraud detection",
    "anomaly detection"
  ],
  "related": [
    "fin.collect-customer-payment"
  ],
  "status": "active",
  "created": "2026-09-05",
  "updated": "2026-09-14",
  "version": 2
}
