{
  "$schema": "https://public-agents.com/schemas/job.schema.json",
  "schemaVersion": 1,
  "id": "hr.schedule-interviews",
  "function": "hr",
  "name": "Schedule interviews across candidates and panels",
  "outcome": "Interview slots are booked across candidate and panel calendars without back-and-forth.",
  "measures": [
    "time from shortlist to first interview",
    "reschedules per interview"
  ],
  "aliases": [
    "interview coordination",
    "interview scheduling",
    "candidate scheduling",
    "panel interview scheduling",
    "recruiting coordination",
    "interview logistics"
  ],
  "status": "active",
  "created": "2026-09-05",
  "updated": "2026-09-15",
  "version": 2
}
